[
  {
    "actionable": true,
    "author": {
      "association": "NONE",
      "id": "BOT_kgDOCCSy2w",
      "login": "coderabbitai",
      "typename": "Bot"
    },
    "authored_at": "2026-08-06T07:44:16Z",
    "body_content_hash": "sha256:760d28fe311f8c9d0a38cf76746c25d06cbcf3acc10c0471e8f30755ad319e46",
    "duplicate_count": 1,
    "edited": true,
    "finding_id": "finding:f3db2d91a13a1982a3d18cd9ed47a1f653230437067a71af5e3c36f39aa934a9",
    "kind": "thread_comment",
    "last_edited_at": "2026-08-06T08:05:29Z",
    "path": "schemas/experimental/memory.source_record.v0.example.json",
    "schema": "casegraphen.experimental.github.review_finding.v0",
    "source_record_id": "github-source:review_threads:sha256-03229662f2b7e1b327b5d8d8ef76d7e01d1fd5b883d52d6ea624dc81cff5d918",
    "thread": {
      "comment_count": 3,
      "outdated": true,
      "resolved": true,
      "resolved_by": {
        "id": "MDQ6VXNlcjc5MDUxMQ==",
        "login": "rizumita"
      },
      "thread_id": "PRRT_kwDOTn7XYM6W58sN"
    },
    "url": "https://github.com/CAPHTECH/casegraphen/pull/101#discussion_r3726868166"
  },
  {
    "actionable": true,
    "author": {
      "association": "NONE",
      "id": "BOT_kgDOCCSy2w",
      "login": "coderabbitai",
      "typename": "Bot"
    },
    "authored_at": "2026-08-06T07:44:16Z",
    "body_content_hash": "sha256:1bc9022a2550db1309ebf070a98fb6b05cb982aa2130b921e2e27097dc947639",
    "duplicate_count": 1,
    "edited": true,
    "finding_id": "finding:4000dd8d895a280c65d117f316676cf53e9218b32dd4122eb688c1c5c78b6c4a",
    "kind": "thread_comment",
    "last_edited_at": "2026-08-06T08:05:31Z",
    "path": "skills/casegraphen-memory-query/SKILL.md",
    "schema": "casegraphen.experimental.github.review_finding.v0",
    "source_record_id": "github-source:review_threads:sha256-03229662f2b7e1b327b5d8d8ef76d7e01d1fd5b883d52d6ea624dc81cff5d918",
    "thread": {
      "comment_count": 3,
      "outdated": true,
      "resolved": true,
      "resolved_by": {
        "id": "MDQ6VXNlcjc5MDUxMQ==",
        "login": "rizumita"
      },
      "thread_id": "PRRT_kwDOTn7XYM6W58sS"
    },
    "url": "https://github.com/CAPHTECH/casegraphen/pull/101#discussion_r3726868174"
  },
  {
    "actionable": true,
    "author": {
      "association": "NONE",
      "id": "BOT_kgDOCCSy2w",
      "login": "coderabbitai",
      "typename": "Bot"
    },
    "authored_at": "2026-08-06T07:44:16Z",
    "body_content_hash": "sha256:34d431db6a01d110617704e589a845a08632a869923d78fb2979e40b7e0bce80",
    "duplicate_count": 1,
    "edited": true,
    "finding_id": "finding:f77099258860484bdf5df7d1fd8844b31325011ba3bb71a039805991375b7d1c",
    "kind": "thread_comment",
    "last_edited_at": "2026-08-06T08:05:31Z",
    "path": "src/bin/casegraphen-mcp-host.rs",
    "schema": "casegraphen.experimental.github.review_finding.v0",
    "source_record_id": "github-source:review_threads:sha256-03229662f2b7e1b327b5d8d8ef76d7e01d1fd5b883d52d6ea624dc81cff5d918",
    "thread": {
      "comment_count": 3,
      "outdated": false,
      "resolved": true,
      "resolved_by": {
        "id": "MDQ6VXNlcjc5MDUxMQ==",
        "login": "rizumita"
      },
      "thread_id": "PRRT_kwDOTn7XYM6W58sa"
    },
    "url": "https://github.com/CAPHTECH/casegraphen/pull/101#discussion_r3726868198"
  },
  {
    "actionable": true,
    "author": {
      "association": "NONE",
      "id": "BOT_kgDOCCSy2w",
      "login": "coderabbitai",
      "typename": "Bot"
    },
    "authored_at": "2026-08-06T07:44:16Z",
    "body_content_hash": "sha256:8cf53db4b5f3aa84d8062f8dbf6c54998f0d2934281e9ad6ff9d5eea3d095ad1",
    "duplicate_count": 1,
    "edited": true,
    "finding_id": "finding:96badcf4878ef4977204aad52cacc2c53f9400e7b1a5e6192a2aacd84fc6d61e",
    "kind": "thread_comment",
    "last_edited_at": "2026-08-06T08:05:33Z",
    "path": "src/memory/authority.rs",
    "schema": "casegraphen.experimental.github.review_finding.v0",
    "source_record_id": "github-source:review_threads:sha256-03229662f2b7e1b327b5d8d8ef76d7e01d1fd5b883d52d6ea624dc81cff5d918",
    "thread": {
      "comment_count": 3,
      "outdated": false,
      "resolved": true,
      "resolved_by": {
        "id": "MDQ6VXNlcjc5MDUxMQ==",
        "login": "rizumita"
      },
      "thread_id": "PRRT_kwDOTn7XYM6W58se"
    },
    "url": "https://github.com/CAPHTECH/casegraphen/pull/101#discussion_r3726868206"
  },
  {
    "actionable": true,
    "author": {
      "association": "NONE",
      "id": "BOT_kgDOCCSy2w",
      "login": "coderabbitai",
      "typename": "Bot"
    },
    "authored_at": "2026-08-06T07:44:16Z",
    "body_content_hash": "sha256:7b036e7101b2f36bc02b78dc476138d328c851cdc385c55680308bcf3df3a6de",
    "duplicate_count": 1,
    "edited": true,
    "finding_id": "finding:bdd38d88d47fd4fce3297811db02a2f1d27eea844cae5764961472af50472f45",
    "kind": "thread_comment",
    "last_edited_at": "2026-08-06T08:05:33Z",
    "path": "src/memory/conflicts.rs",
    "schema": "casegraphen.experimental.github.review_finding.v0",
    "source_record_id": "github-source:review_threads:sha256-03229662f2b7e1b327b5d8d8ef76d7e01d1fd5b883d52d6ea624dc81cff5d918",
    "thread": {
      "comment_count": 3,
      "outdated": false,
      "resolved": true,
      "resolved_by": {
        "id": "BOT_kgDOCCSy2w",
        "login": "coderabbitai[bot]"
      },
      "thread_id": "PRRT_kwDOTn7XYM6W58si"
    },
    "url": "https://github.com/CAPHTECH/casegraphen/pull/101#discussion_r3726868212"
  },
  {
    "actionable": true,
    "author": {
      "association": "NONE",
      "id": "BOT_kgDOCCSy2w",
      "login": "coderabbitai",
      "typename": "Bot"
    },
    "authored_at": "2026-08-06T07:44:16Z",
    "body_content_hash": "sha256:14fc938eb248866739abf246ffe262e1a8dfb0305cc54c7127b76526c5baa869",
    "duplicate_count": 1,
    "edited": true,
    "finding_id": "finding:5b3e65ded051ce00e45f66db5cfe93ffb456a7656548cb45894a909ef8c8c12d",
    "kind": "thread_comment",
    "last_edited_at": "2026-08-06T08:05:35Z",
    "path": "src/memory/query.rs",
    "schema": "casegraphen.experimental.github.review_finding.v0",
    "source_record_id": "github-source:review_threads:sha256-03229662f2b7e1b327b5d8d8ef76d7e01d1fd5b883d52d6ea624dc81cff5d918",
    "thread": {
      "comment_count": 3,
      "outdated": false,
      "resolved": true,
      "resolved_by": {
        "id": "BOT_kgDOCCSy2w",
        "login": "coderabbitai[bot]"
      },
      "thread_id": "PRRT_kwDOTn7XYM6W58so"
    },
    "url": "https://github.com/CAPHTECH/casegraphen/pull/101#discussion_r3726868221"
  },
  {
    "actionable": true,
    "author": {
      "association": "NONE",
      "id": "BOT_kgDOCCSy2w",
      "login": "coderabbitai",
      "typename": "Bot"
    },
    "authored_at": "2026-08-06T07:44:17Z",
    "body_content_hash": "sha256:848192ed36f6327072304605cd0e594511c1343ca3708e2139b5c484235f9999",
    "duplicate_count": 1,
    "edited": true,
    "finding_id": "finding:2a12217584111f98934b0b71cfd1b1f66846e6111f493097aae5351812862079",
    "kind": "thread_comment",
    "last_edited_at": "2026-08-06T08:06:08Z",
    "path": "src/memory/validation.rs",
    "schema": "casegraphen.experimental.github.review_finding.v0",
    "source_record_id": "github-source:review_threads:sha256-03229662f2b7e1b327b5d8d8ef76d7e01d1fd5b883d52d6ea624dc81cff5d918",
    "thread": {
      "comment_count": 3,
      "outdated": false,
      "resolved": true,
      "resolved_by": {
        "id": "BOT_kgDOCCSy2w",
        "login": "coderabbitai[bot]"
      },
      "thread_id": "PRRT_kwDOTn7XYM6W58ss"
    },
    "url": "https://github.com/CAPHTECH/casegraphen/pull/101#discussion_r3726868226"
  },
  {
    "actionable": true,
    "author": {
      "association": "NONE",
      "id": "BOT_kgDOCCSy2w",
      "login": "coderabbitai",
      "typename": "Bot"
    },
    "authored_at": "2026-08-06T07:44:17Z",
    "body_content_hash": "sha256:cf55400a8868c7ac682b099d67e8ce0a79c93c3a9f74aac8c4c1637d328fed53",
    "duplicate_count": 1,
    "edited": true,
    "finding_id": "finding:6db94e57507704c9fdbb5cfef21b2c736cce48a02c1bb7d347a266ae94783762",
    "kind": "thread_comment",
    "last_edited_at": "2026-08-06T08:05:37Z",
    "path": "src/memory/validation.rs",
    "schema": "casegraphen.experimental.github.review_finding.v0",
    "source_record_id": "github-source:review_threads:sha256-03229662f2b7e1b327b5d8d8ef76d7e01d1fd5b883d52d6ea624dc81cff5d918",
    "thread": {
      "comment_count": 3,
      "outdated": false,
      "resolved": true,
      "resolved_by": {
        "id": "MDQ6VXNlcjc5MDUxMQ==",
        "login": "rizumita"
      },
      "thread_id": "PRRT_kwDOTn7XYM6W58s0"
    },
    "url": "https://github.com/CAPHTECH/casegraphen/pull/101#discussion_r3726868235"
  },
  {
    "actionable": true,
    "author": {
      "association": "NONE",
      "id": "BOT_kgDOCCSy2w",
      "login": "coderabbitai",
      "typename": "Bot"
    },
    "authored_at": "2026-08-06T07:44:17Z",
    "body_content_hash": "sha256:c8455e8a7ba6fc4838f206b8e1a34154c4be8018e843fdfd31fa2ea9ed54bb60",
    "duplicate_count": 1,
    "edited": true,
    "finding_id": "finding:44cff42807677106d1fda3f7123d72d3fd24e33641de5e22fa6a9be899136df8",
    "kind": "thread_comment",
    "last_edited_at": "2026-08-06T08:06:15Z",
    "path": "src/native_cli/parser.rs",
    "schema": "casegraphen.experimental.github.review_finding.v0",
    "source_record_id": "github-source:review_threads:sha256-03229662f2b7e1b327b5d8d8ef76d7e01d1fd5b883d52d6ea624dc81cff5d918",
    "thread": {
      "comment_count": 3,
      "outdated": false,
      "resolved": true,
      "resolved_by": {
        "id": "BOT_kgDOCCSy2w",
        "login": "coderabbitai[bot]"
      },
      "thread_id": "PRRT_kwDOTn7XYM6W58s5"
    },
    "url": "https://github.com/CAPHTECH/casegraphen/pull/101#discussion_r3726868242"
  },
  {
    "actionable": false,
    "author": {
      "association": "NONE",
      "id": "BOT_kgDOCCSy2w",
      "login": "coderabbitai",